{
  "id": "2026-steering-002",
  "clik_docid": null,
  "date": "2026-07-09",
  "type": "의회운영위원회",
  "session": "제335회(폐회중)",
  "agendas": [],
  "minutes_html": null,
  "minutes_url": "https://council.shinan.go.kr",
  "_meta": {
    "source_url": "https://council.shinan.go.kr",
    "source_system": "MANUAL",
    "snapshot_path": "snapshots/신안군의회 회의록20260709_.pdf",
    "source_alive": true,
    "collected_at": "2026-07-17",
    "reviewed_by": "장경수",
    "reviewed_at": "2026-07-17"
  }
}
