{
  "id": "2026-plenary-001",
  "clik_docid": null,
  "date": "2026-07-02",
  "type": "본회의",
  "session": "제335회",
  "agendas": [],
  "minutes_html": null,
  "minutes_url": "https://council.shinan.go.kr",
  "_meta": {
    "source_url": "https://council.shinan.go.kr",
    "source_system": "MANUAL",
    "snapshot_path": "snapshots/신안군의회 회의록20260702_.pdf",
    "source_alive": true,
    "collected_at": "2026-07-17",
    "reviewed_by": "장경수",
    "reviewed_at": "2026-07-17"
  }
}
