{
  "id": "2026-plenary-002",
  "clik_docid": null,
  "date": "2026-07-14",
  "type": "본회의",
  "session": "제336회",
  "agendas": [
    "2026-proc-002",
    "2026-bill-004",
    "2026-bill-001",
    "2026-bill-002",
    "2026-proc-004",
    "2026-proc-005",
    "2026-proc-006",
    "2026-bill-005"
  ],
  "minutes_html": null,
  "minutes_url": "https://council.shinan.go.kr/mnts/asvr/cnts/mnt/mntViewer.php?params=QktKaEt3SVROeFc5ck42RTVQZnMrQT09",
  "_meta": {
    "source_url": "https://council.shinan.go.kr",
    "source_system": "MANUAL",
    "snapshot_path": "snapshots/신안군의회 회의록20260714_.pdf",
    "source_alive": true,
    "collected_at": "2026-07-17",
    "reviewed_by": "장경수",
    "reviewed_at": "2026-07-18"
  }
}
